{
  "candidate": "candidate-a.md",
  "critic": "adversarial-reader",
  "verdict": "pass",
  "confidence": 0.76,
  "findings": [
    {
      "dimension": "son-cannot-reach",
      "severity": "minor",
      "evidence": "about Kieran's knuckles, and Kieran's eye, and the once about Kieran's neck",
      "diagnosis": "The son is planted as past covering-history; the brief's specific lever — the son she cannot reach NOW — stays dormant.",
      "repair_layer": "discourse"
    },
    {
      "dimension": "ambiguity-tip",
      "severity": "minor",
      "evidence": "she did not let herself think about why a man would not",
      "diagnosis": "Sharpest tip toward the danger reading (evidence-avoidance), held open by Jo's refusal to resolve; stays both-ways.",
      "repair_layer": "prose"
    }
  ],
  "audit_class": "literary",
  "candidate_sha256": "fd4ba9fd04a9f8292efe8cebee72470219fb5c4b68ac568fabd3d69afebb894f"
}
