{
  "candidate": "candidate-a.md",
  "candidate_sha256": "3dcd47ec50a242dde535d7b050e126613a0a81829d1637f52c74a0fe26df1ddb",
  "critic": "style-editor",
  "audit_class": "literary",
  "verdict": "revise",
  "confidence": 0.72,
  "findings": [
    {
      "dimension": "style-drift",
      "severity": "material",
      "evidence": "the way the skin goes on remembering a splinter after it is drawn",
      "diagnosis": "One of four aphoristic 'the way...' constructions in a short scene; as a set they install a sententious narrator that drifts from 'steady, unshowy', and this one converts a tactile finding into decorative simile at the beat that should stay physical.",
      "repair_layer": "prose"
    },
    {
      "dimension": "abstraction",
      "severity": "minor",
      "evidence": "the low plank that runs against the keel and does the hardest of the work, the one that lives in the water",
      "diagnosis": "Expository gloss of 'garboard' plus personification that sentimentalizes a plank.",
      "repair_layer": "prose"
    },
    {
      "dimension": "interpretive-tag",
      "severity": "minor",
      "evidence": "He said it like a dare.",
      "diagnosis": "The tag supplies the tone the line 'Seven o'clock.' should carry alone.",
      "repair_layer": "prose"
    }
  ]
}
