{
  "candidate": "candidate-b.md",
  "candidate_sha256": "2bbc56aa3d53a2d4dad54460651345e8c4d6411a1200a30c27854d782bcfab14",
  "critic": "adversarial-reader",
  "audit_class": "literary",
  "verdict": "pass",
  "confidence": 0.66,
  "findings": [
    {"dimension": "curated-bleakness", "severity": "minor", "evidence": "A good clear photo of nobody's mother looking at nothing.", "diagnosis": "The emotional climax turns epigrammatic — the nobody/nothing patterning declares emptiness rather than rendering it; stylized despair is its own default. (Style-editor grades this the same line material; disagreement preserved.)", "repair_layer": "prose"},
    {"dimension": "abstraction", "severity": "minor", "evidence": "The stamp gone to nothing on her hand", "diagnosis": "Swaps a tactile, concrete beat for a commentary phrase; weakens the cost-carried-in-the-body mandate.", "repair_layer": "prose"},
    {"dimension": "enactment-thinned", "severity": "minor", "evidence": "Next month she'd bring a kinder one. Or say the phone had played up.", "diagnosis": "The recurring-lie engine is compressed past the point where the deliberate downgrade (choosing a worse photo on purpose) is legible.", "repair_layer": "discourse"}
  ]
}
